{
  "kind": "cineweave_codex_image_prompt",
  "worldId": "world-cloud-dynasty",
  "shotId": "scene-01-shot-04",
  "skillReceipt": {
    "repository": "https://github.com/owner/repository",
    "ref": "v0.2.0",
    "commit": "0123456789abcdef0123456789abcdef01234567",
    "contentHash": "sha256:aaaaaaaaaaaaaaaaaaaaaaaaaaaaaaaaaaaaaaaaaaaaaaaaaaaaaaaaaaaaaaaa",
    "installedBy": "codex-environment",
    "usedAt": "2026-08-18T12:00:00.000Z"
  },
  "intent": {
    "narrativePurpose": "让女主第一次看见云上天宫时感到敬畏，而不是恐惧；画面停在认知被改写的瞬间。",
    "audienceFeeling": "好奇 → 等待 → 敬畏 → 静默",
    "primaryTarget": "远方高处的天宫作为被延迟揭示的视觉中心",
    "secondaryTarget": "女主背影作为真实的人体尺度锚点"
  },
  "shotDesign": {
    "primaryTarget": "前景巨柱退出后显露的远方天宫",
    "shotScale": "wide environmental shot",
    "cameraAngle": "slightly low eye-level, respectful rather than heroic",
    "cameraHeight": "below the woman's eye line",
    "lens": {
      "focalLengthMm": 24,
      "character": "空间扩张、保留前景柱的近距离压迫和天宫的远距尺度"
    },
    "depth": [
      "foreground stone column partially occludes the left edge",
      "midground woman remains small and readable as a scale anchor",
      "background cloud layers separate the palace from the sky"
    ],
    "movementCue": {
      "type": "truck",
      "direction": "slowly right through the foreground column",
      "speedCurve": "near-static start, gentle acceleration during the reveal, ease-out into a 1.5-second hold",
      "startState": "the palace is mostly hidden and the woman has just stopped",
      "peakState": "the column clears and the palace occupies the upper distance",
      "endState": "the woman's eyeline and the palace form one stable diagonal"
    },
    "focusTarget": "the palace facade after the reveal, with the woman legible but not dominant",
    "composition": {
      "primaryTarget": "the distant palace",
      "layout": "palace in the upper third, woman in the lower third, column as left-side occlusion",
      "depthLayers": ["column", "woman and stone bridge", "cloud sea and palace", "distant pale sky"],
      "subjectScale": "the woman occupies approximately three percent of frame height",
      "negativeSpace": "quiet sky around the palace to preserve sacred scale"
    },
    "actionMoment": "the woman has stopped walking and lifts her gaze just as the palace becomes fully legible",
    "endState": "the reveal has settled into a quiet, reviewable composition",
    "styleStack": [
      { "label": "东方诗意", "weight": 0.45 },
      { "label": "史诗巨构", "weight": 0.35 },
      { "label": "清冷纪实光线", "weight": 0.2 }
    ]
  },
  "promptBlocks": {
    "world": ["云上王朝世界", "女主保持月白朱绫轮廓与既定身份", "天宫位于远方高处，不新增 Canon 事实"],
    "story": ["女主停步抬眼", "认知从近处石桥转向远方天宫", "情绪是敬畏而非恐惧"],
    "subject": ["小比例女性背影", "动作克制、重心真实", "发丝和衣带只承担轻微风的响应"],
    "miseEnScene": ["前景巨柱遮挡左侧", "石桥作为地面和尺度锚点", "分层云海与远方宫城形成空气透视"],
    "camera": ["wide environmental shot", "24mm lens", "slightly low eye-level", "slow rightward truck translated into a reveal frame", "palace becomes the focus target after the occlusion clears"],
    "lighting": ["cool ambient sky light", "motivated warm rim from low sunset behind the palace", "consistent shadow direction", "subtle falloff rather than global glow"],
    "realism": ["physically coherent perspective", "stone, silk, cloud and metal respond differently to light", "contact feet and garment weight remain believable", "restrained atmospheric haze and natural asymmetry"],
    "style": ["poetic East Asian visual grammar", "monumental architecture", "live-action cinematic realism", "restrained palette of moon white, stone blue and warm ivory"],
    "technical": ["single cinematic still", "storyboard/keyframe candidate", "clean upper negative space", "provider-neutral prompt package"]
  },
  "prompt": {
    "language": "bilingual",
    "concise": "电影感写实宽幅环境镜头：月白朱绫女子背影站在云上石桥下方三分之一，前景巨柱遮挡左侧，缓慢向右横移后显露远方高处天宫；24mm、略低于眼平、冷环境光与低角度暖色逆光、分层云雾、真实石材与丝绸材质、敬畏而非恐惧、克制的东方诗意、稳定的终帧构图。",
    "expanded": "A cinematic live-action realistic wide environmental still from a Cloud Dynasty world. A woman in the established moon-white red-trimmed silk silhouette has stopped on a stone bridge and raises her gaze; she remains a small human scale anchor in the lower third. A massive foreground column occludes the left side, and the distant palace in the upper distance becomes fully legible as the camera's slow rightward reveal reaches its peak. 24mm lens, slightly low eye-level camera, readable foreground/midground/background depth, cool ambient sky light with a motivated warm rim from a low sunset behind the palace, coherent shadow direction, physically distinct stone, silk, cloud and metal materials, restrained atmospheric perspective, natural posture and fabric weight, quiet awe rather than fear, restrained East Asian poetic visual grammar and live-action cinematic realism."
  },
  "negativePrompt": [
    "do not show the palace fully at the first visual read",
    "no global magical glow or plastic game-render materials",
    "no identity drift, costume redesign or duplicated anatomy",
    "no impossible light directions or floating architecture",
    "no exaggerated fear expression, poster symmetry or decorative text"
  ],
  "preserve": [
    "woman's established identity and moon-white red-trimmed silhouette",
    "palace remains distant and high",
    "woman remains a small scale anchor",
    "cool environment light and warm rim light keep their direction"
  ],
  "allowedChanges": [
    "foreground column width",
    "cloud density",
    "palace visibility at the reveal peak"
  ],
  "validation": {
    "onePrimaryTarget": true,
    "physicalLight": true,
    "cameraCoherent": true,
    "realismAnchors": [
      "motivated light and coherent shadows",
      "distinct material response",
      "perspective and scale anchors",
      "natural anatomy and fabric weight"
    ],
    "providerNeutral": true
  }
}
